date,source,title,url,category,importance,summary
2026-04-19,Al Jazeera Iran,US forces attack and seize Iranian ship Touska near Strait of Hormuz,https://www.aljazeera.com/video/newsfeed/2026/4/19/us-forces-attack-and-seize-iranian-ship-touska-near-strait-of-hormuz,ホルムズ海峡,5,US forces attack and seize Iranian ship Touska near Strait of Hormuz
2026-04-19,AP Middle East,US seizes Iranian-flagged ship near Strait of Hormuz and Tehran vows to respond,https://apnews.com/article/us-iran-war-israel-hormuz-19-april-2026-0a637f98d588930f195f61cffe07d4f3,ホルムズ海峡,4,US seizes Iranian-flagged ship near Strait of Hormuz and Tehran vows to respond
2026-04-19,AP Middle East,Iran fully closes Strait of Hormuz over US blockade and fires on ships,https://apnews.com/article/us-iran-war-israel-hormuz-18-april-2026-ab475cb979825b956a10d60103026b37,ホルムズ海峡,4,Iran fully closes Strait of Hormuz over US blockade and fires on ships
2026-04-19,AP Middle East,Iran fires on ships in Strait of Hormuz as Tehran imposes restrictions again,https://apnews.com/live/iran-war-israel-trump-04-18-2026,ホルムズ海峡,4,Iran fires on ships in Strait of Hormuz as Tehran imposes restrictions again
2026-04-19,AP Middle East,AP visualizes why the Strait of Hormuz is a keystone of the world economy,https://apnews.com/article/the-worlds-most-important-21-miles-0000019d2fbfd29daffdefffc72e0000,ホルムズ海峡,4,AP visualizes why the Strait of Hormuz is a keystone of the world economy
2026-04-19,AP Middle East,US extends waiver on Russian oil sanctions to ease Iran war shortages despite Bessent denial,https://apnews.com/article/russian-oil-sanctions-iran-war-95ae06ece63f4f8c1f72ac3c2dc4251f,制裁,4,US extends waiver on Russian oil sanctions to ease Iran war shortages despite Bessent denial
2026-04-19,AP Middle East,UK gathers more than 40 countries to press Iran to reopen the Strait of Hormuz,https://apnews.com/article/hormuz-strait-shipping-summit-uk-iran-ca2c6af551df98c81a39f2137e417856,ホルムズ海峡,4,UK gathers more than 40 countries to press Iran to reopen the Strait of Hormuz
2026-04-19,Al Jazeera Iran,Trump says US seized Iranian ship trying to get past blockade near Hormuz,https://www.aljazeera.com/news/2026/4/19/trump-says-us-seized-iran-flagged-ship-trying-to-get-past-hormuz-blockade,ホルムズ海峡,4,Trump says US seized Iranian ship trying to get past blockade near Hormuz
2026-04-19,Al Jazeera Iran,What to know about US-Iran standoff over the Strait of Hormuz,https://www.aljazeera.com/news/2026/4/19/what-to-know-about-us-iran-standoff-over-the-strait-of-hormuz,ホルムズ海峡,4,What to know about US-Iran standoff over the Strait of Hormuz
2026-04-19,Al Jazeera Iran,Iran warns Hormuz will stay shut unless US lifts siege on its ports,https://www.aljazeera.com/video/newsfeed/2026/4/19/iran-warns-hormuz-will-stay-shut-unless-us-lifts-siege-on-its-ports,ホルムズ海峡,4,Iran warns Hormuz will stay shut unless US lifts siege on its ports
2026-04-19,Al Jazeera Iran,Iran war day 51: What is happening in Lebanon and the Strait of Hormuz?,https://www.aljazeera.com/news/2026/4/19/iran-war-what-is-happening-on-day-51-of-the-us-iran-conflict,ホルムズ海峡,4,Iran war day 51: What is happening in Lebanon and the Strait of Hormuz?
2026-04-19,Al Jazeera Iran,"Iran, US still ‘far’ from breakthrough amid Strait of Hormuz impasse",https://www.aljazeera.com/news/2026/4/19/iran-us-still-far-from-breakthrough-in-strait-of-hormuz-impasse,ホルムズ海峡,4,"Iran, US still ‘far’ from breakthrough amid Strait of Hormuz impasse"
2026-04-19,Al Jazeera Iran,Iran navy says any ship trying to pass Strait of Hormuz will be targeted,https://www.aljazeera.com/news/2026/4/18/iran-reasserts-control-of-hormuz-strait-as-trump-warns-against-blackmail,ホルムズ海峡,4,Iran navy says any ship trying to pass Strait of Hormuz will be targeted
2026-04-19,Al Jazeera Iran,Iran military orders Indian ship to abort Strait of Hormuz passage,https://www.aljazeera.com/video/newsfeed/2026/4/18/iran-military-orders-indian-ship-to-abort-strait-of-hormuz-passage,ホルムズ海峡,4,Iran military orders Indian ship to abort Strait of Hormuz passage
2026-04-19,AP Middle East,Iranian official says US ‘maximalist’ demands stall face-to-face talks,https://apnews.com/article/iran-deputy-foreign-minister-interview-40d8e43e3c7b5a23cda6783b064b9dbf,外交,3,Iranian official says US ‘maximalist’ demands stall face-to-face talks
2026-04-19,AP Middle East,"Sri Lanka sent home 238 Iranian sailors, including survivors of a US torpedo attack",https://apnews.com/article/sri-lanka-iran-sailors-us-torpedo-b214171b3fc145e61875dbb3c584b2f8,軍事,3,"Sri Lanka sent home 238 Iranian sailors, including survivors of a US torpedo attack"
2026-04-19,AP Middle East,How a US blockade on Iran has sanctioned ships turning around,https://apnews.com/article/us-iran-war-navy-blockade-strait-of-hormuz-5ede64fed469d3cf99524976183e3bfc,制裁,3,How a US blockade on Iran has sanctioned ships turning around
2026-04-19,AP Middle East,US and Iran end 21-hour ceasefire talks without agreement before Vance departs Pakistan,https://apnews.com/article/iran-us-israel-trump-lebanon-april-11-2026-2be904aee3f804892336730279e054b9,外交,3,US and Iran end 21-hour ceasefire talks without agreement before Vance departs Pakistan
2026-04-19,AP Middle East,Gaza marks 6 months of a ceasefire that may offer lessons for the Iran war,https://apnews.com/article/gaza-ceasefire-palestinians-israel-six-months-5435d3ebd95d00d6dcbe395c14f2e524,外交,3,Gaza marks 6 months of a ceasefire that may offer lessons for the Iran war
2026-04-19,AP Middle East,US and Iran prepare for high-level talks as Israel and Hezbollah trade more fire,https://apnews.com/article/iran-us-israel-trump-lebanon-april-10-2026-1acfb8e733e476b0919689e0682cbb05,外交,3,US and Iran prepare for high-level talks as Israel and Hezbollah trade more fire
2026-04-19,Al Jazeera Iran,"Israeli attacks on healthcare across Iran, Lebanon and Gaza",https://www.aljazeera.com/video/newsfeed/2026/4/19/israeli-attacks-on-healthcare-across-iran-lebanon-and-gaza,軍事,3,"Israeli attacks on healthcare across Iran, Lebanon and Gaza"
2026-04-19,Al Jazeera Iran,What would it take for the Iran-US talks to succeed?,https://www.aljazeera.com/video/the-bottom-line/2026/4/19/what-would-it-take-for-the-iran-us-talks-to-succeed,外交,3,What would it take for the Iran-US talks to succeed?
2026-04-19,Al Jazeera Iran,Trump to send US delegation to Pakistan for possible Iran talks,https://www.aljazeera.com/news/2026/4/19/trump-says-us-negotiators-will-head-to-pakistan-for-iran-ceasefire-talks,外交,3,Trump to send US delegation to Pakistan for possible Iran talks
